"CONTRACT_ID","CONTRACT_LINE_ID","LINE_TYPE","CONTRACT_LINE_NUM","ITEM_ID","CATEGORY_ID","CONTRACT_LINE_DESCRIPTION","UOM","QTY_LIMIT","UNIT_PRICE","SUPPLIER_ITEM_REF","CANCEL_FLAG"
81314,102966,"Goods",649,,36,"Palmolive Ultra Dish Liquid, 28 ounces","EA","",4.54,"CPM46128","N"
81314,102967,"Goods",650,,36,"Palmolive Ultra Dishwashing Liquid and Antibacterial Hand Soap, 28 ounces","EA","",4.54,"CPM47928","N"
81314,102968,"Goods",651,,36,"Huskee Jani-Carrier, Gray","EA","",8.4,"CMC00957","N"
81314,102969,"Goods",652,,36,"Utility Bucket, 10 Quart, Gray","EA","",6.8,"CMC00767","N"
81314,102970,"Goods",653,,36,"Huskee Divided Plastic Pail, 16 Quarts, Gray","EA","",16.8,"CMC01390","N"
81314,102971,"Goods",654,,36,"Smoothline Bucket Combo, Yellow","EA","",53,"CMC03486","N"
81314,102972,"Goods",655,,36,"Computation Notebook, 75 Numbered Sets, 4 inch x 4 inch Quad Ruled, 11-3/4 inch x 9-1/4 inch","EA","",15.25,"AVE43648","N"
81314,102973,"Goods",656,,36,"Computation/Engineering Pad, 5 Squares per Inch, 8-1/2 inch x 11 inch","POUND","",3.35,"AVE42381","N"
81314,102974,"Goods",657,,36,"Computation/Engineering Pad, 5 Squares per Inch, 8-1/2 inch x 11 inch","POUND","",5.79,"AVE42382","N"
81314,102975,"Goods",658,,36,"Computation/Engineering Pad, 5 Squares per Inch, 8-1/2 inch x 11 inch","POUND","",10.39,"AVE42389","N"
81314,102976,"Goods",659,,36,"Side-Punched Analysis Pad, 4 Columns, 11 inch x 8-1/2 inch","POUND","",5.79,"AVE45604","N"
81314,102977,"Goods",660,,36,"Side-Punched Analysis Pad, 5 Columns, 11 inch x 8-1/2 inch","POUND","",5.79,"AVE45605","N"
81314,102978,"Goods",661,,36,"Side-Punched Analysis Pad, 6 Columns, 11 inch x 8-1/2 inch","POUND","",5.79,"AVE45606","N"
81314,102979,"Goods",662,,36,"Side-Punched Analysis Pad, 7 Columns, 11 inch x 8-1/2 inch","POUND","",5.79,"AVE45607","N"
81314,102980,"Goods",663,,36,"Side-Punched Analysis Pad, 8 Columns, 11 inch x 8-1/2 inch","POUND","",5.79,"AVE45608","N"
81314,102981,"Goods",664,,36,"Side-Punched Analysis Pad, 13 Columns, 11 inch x 16-3/8 inch","POUND","",12.59,"AVE45613","N"
81314,102982,"Goods",665,,36,"Eye-Ease Top Punched Analysis Pad, 7 Columns, 8-1/2 inch x 14 inch","POUND","",7.25,"AVE45807","N"
81314,102983,"Goods",666,,36,"Side-Punched Analysis Pad, 3 Columns, 11 inch x 8-1/2 inch","POUND","",5.79,"AVE45603","N"
81314,102984,"Goods",667,,36,"Laser Rotary Cards, 2-1/6 inch x 4 inch","BX","",26.71,"AVE05385","N"
81314,102985,"Goods",668,,36,"Laser Rotary Cards, 3 inch x 5 inch, Packed 150 per Box","BX","",26.71,"AVE05386","N"
81314,102986,"Goods",669,,36,"Laminated Rotary Cards, 8-1/2 inch x 11 inch","BX","",18.99,"AVE05364","N"
81314,102987,"Goods",670,,36,"Note Holder, Aluminum, 2 foot","EA","",16.95,"AVT02000","N"
81314,102988,"Goods",671,,36,"Note Holder, Aluminum, 3 foot","EA","",24.95,"AVT02005","N"
81314,102989,"Goods",672,,36,"Personal Size Grip-A-Strip Display Rail, Satin, 9 inch","EA","",7.95,"AVT01500","N"
81314,102990,"Goods",673,,36,"Personal Size Display Rail, Satin Finish, 12 inch","EA","",9.95,"AVT01025","N"
81314,102991,"Goods",674,,36,"Personal Size Grip-A-Strip Display Rail, 48 inch, Satin","EA","",29.95,"AVT02010","N"
81314,102992,"Goods",675,,36,"Personal Size Grip-A-Strip Display Rail, 96 inch, Satin","EA","",54.95,"AVT02015","N"
81314,102993,"Goods",676,,36,"Business Card, Inkjet, White, 2 x 3-1/2","EA","",45.21,"AVE08471","N"
81314,102994,"Goods",677,,36,"Folding Table, Walnut/Brown, 30 inch x 96 inch","EA","",132,"BVS16822","N"
81314,102995,"Goods",678,,36,"Folding Table, Walnut/Brown, 36 inch x 72 inch","EA","",139,"BVS18020","N"
81314,102996,"Goods",679,,36,"Folding Table, Walnut/Brown, 30 inch x 60 inch","EA","",108,"BVS17174","N"
81314,102997,"Goods",680,,36,"Folding Table, Light Gray/Light Gray, 30 inch x 96 inch","EA","",132,"BVS47126","N"
81314,102998,"Goods",681,,36,"Folding Table, Light Gray/Light Gray, 30 inch x 72 inch","EA","",112,"BVS47125","N"
81314,102999,"Goods",682,,36,"Folding Table, Light Gray/Light Gray, 30 inch x 60 inch","EA","",108,"BVS47124","N"
81314,103000,"Goods",683,,36,"Folding Table, Walnut/Brown, 36 inch x 26 inch","EA","",125,"BVS17084","N"
81314,103001,"Goods",684,,36,"Folding Table, Walnut/Brown, 24 inch x 48 inch","EA","",108,"BVS16821","N"
81314,103002,"Goods",685,,36,"Folding Table, Walnut/Brown, 36 inch x 96 inch","EA","",168,"BVS16823","N"
81314,103003,"Goods",686,,36,"DEC Laser 3200 Printer Photoreceptor","EA","",319.99,"DEC10011","N"
81314,103004,"Goods",687,,36,"Ribbon for Time Clock, ACP175 and ATT310","EA","",15.63,"ACP04775","N"
81314,103005,"Goods",688,,36,"Acroprint Model 175TR Time Recorder","EA","",399,"ACP04175","N"
81314,103006,"Goods",689,,36,"Electric Print Time Recorder, Day of Week, 0 to 23 Hours, Decimal Hundredths of Hours","EA","",385,"ACP15030","N"
81314,103007,"Goods",690,,36,"Electric Print Time Recorder","EA","",385,"ACP15010","N"
81314,103008,"Goods",691,,36,"Electric Print Time Recorder, Month, Date, Hour and Minutes","EA","",390,"ACP15050","N"
81314,103009,"Goods",692,,36,"Time Q Plus Badge Time and Attendance System","EA","",795,"ACP50555","N"
81314,103010,"Goods",693,,36,"ETC Heavy-Duty Electric Time Stamp with Digital Display","EA","",499,"ACP31110","N"
81314,103011,"Goods",694,,36,"ETC Heavy-Duty Electric Time Stamp without Digital Display","EA","",435.76,"ACP32220","N"
81314,103012,"Goods",695,,36,"Time Recorder, ATT 310 Totalizing","EA","",599,"ACP03100","N"
81314,103013,"Goods",696,,36,"Manual Time Recorder MD12 HeightM","EA","",320,"ACP12050","N"
81314,103014,"Goods",697,,36,"Manual Time Recorder","EA","",315,"ACP12010","N"
81314,103015,"Goods",698,,36,"Digital LN03 Printer Toner Kit, 6000 Pages","Kit","",65,"DEC10152","N"
81314,103016,"Goods",699,,36,"Magnetic Tape, 1/2 inch x 10 feet","ROLL","",5.95,"BAU66010","N"
81314,103017,"Goods",700,,36,"Magnetic Tape, 1 inch x 100 feet","ROLL","",94.95,"BAU66100","N"
81314,103018,"Goods",701,,36,"Fastener, 2 Piece, Complete, 3-1/2 inch, 4-1/4CC","EA","",14.49,"ACC70424","N"
81314,103019,"Goods",702,,36,"Fastener, 2 Piece, Complete, 3-1/2 inch, 2.75CC","EA","",11.39,"ACC70324","N"
81314,103020,"Goods",703,,36,"Verse Different Height Panel Connector, Gray","EA","",17,"BPI01145","N"
81314,103021,"Goods",704,,36,"Verse Different Height 2 Panel Connector, Gray","EA","",22,"BPI00168","N"
81314,103022,"Goods",705,,36,"Pressboard Wirebound Notebook, 3 Hole Punched, Wide Ruled, Five Subject","EA","",4.49,"AVE31983","N"
81314,103023,"Goods",706,,36,"Porta Desk Top-Opening Wirebound Notebook, Letter, College","EA","",5.09,"AVE31186","N"
81314,103024,"Goods",707,,36,"AC Adapter for P-Touch Labeler","EA","",24.99,"BRT05425","N"
81314,103025,"Goods",708,,36,"AC Adapter for P-Touch Labeler","EA","",24.95,"BRT05168","N"
81314,103026,"Goods",709,,36,"Windex Glass Cleaner Aerosol Can, 20 ounce","EA","",4,"DRA90129","N"
81314,103027,"Goods",710,,36,"Windex Glass Cleaner, 1 gallon Refill","EA","",12.27,"DRA90940","N"
81314,103028,"Goods",711,,36,"Windex Glass Cleaner, 32 ounce Non-Aerosol Trigger Bottle","EA","",5.21,"DRA90135","N"
81314,103029,"Goods",712,,36,"Cold Pack","EA","",2.75,"ACM51013","N"
81314,103030,"Goods",713,,36,"Stop-Step 4-Step Ladder with Right Handrail, 27 inch Top Step, 23-3/4 inch x 33-1/2 inch x 40-3/4 inch","EA","",643,"CRA14122","N"
81314,103031,"Goods",714,,36,"Folding Platform Ladder, 19 inch x 29 inch x 32-3/4 inch","EA","",268,"CRA11302","N"
81314,103032,"Goods",715,,36,"Top Punched Analysis Pad, 6 Columns, 8-1/2 inch x 14 inch","EA","",7.25,"AVE45806","N"
81314,103033,"Goods",716,,36,"Verse Panel Wall Mount Bracket, Gray","EA","",21,"BPI00080","N"
81314,103034,"Goods",717,,36,"Verse Panel to Worksurface Support Bracket","EA","",14,"BPI00138","N"
81314,103035,"Goods",718,,36,"Jumbo Ballpoint and Selectip Refill, Fine, Blue","EA","",4,"CRO01609","N"
81314,103036,"Goods",719,,36,"Ball Pen Refill, Medium Point, Black","EA","",2.75,"CRO08513","N"
81314,103037,"Goods",720,,36,"Cross Ball Pen Refill, Medium Point, Blue","EA","",2.75,"CRO08511","N"
81314,103038,"Goods",721,,36,"Cross Ball Pen Refill, Fine Point, Black","EA","",2.75,"CRO08514","N"
81314,103039,"Goods",722,,36,"Cross Ball Pen Refill, Fine Point, Blue","EA","",2.75,"CRO08512","N"
81314,103040,"Goods",723,,36,"Cross Selectip Porous Point Pen Refill, Fine, Black","EA","",2.8,"CRO08444","N"
81314,103041,"Goods",724,,36,"Cross Selectip Porous Point Pen Refill, Medium, Black","EA","",2.8,"CRO08443","N"
81314,103042,"Goods",725,,36,"Selectip Rollerball Pen Refill, Fine Point, Black","EA","",3.3,"CRO08523","N"
81314,103043,"Goods",726,,36,"Selectip Rollerball Pen Refill, Fine Point, Blue","EA","",3.3,"CRO08521","N"
81314,103044,"Goods",727,,36,"Jumbo Ballpoint and Selectip Refill, Fine, Black","EA","",4,"CRO01607","N"
81314,103045,"Goods",728,,36,"Jumbo Ballpoint and Selectip Refill, Medium, Blue","EA","",4,"CRO01608","N"
81314,103046,"Goods",729,,36,"Jumbo Ballpoint and Selectip Refill, Medium, Black","EA","",4,"CRO01606","N"
81314,103047,"Goods",730,,36,"Document Marker Refill, Yellow","EA","",3,"CRO01059","N"
81314,103048,"Goods",731,,36,"Selectip Porous Point Pen Refill, Fine, Blue","EA","",2.8,"CRO08442","N"
81314,103049,"Goods",732,,36,"Industrial Support Belt, Small, 28 inch to 32 inch, Black","EA","",42.95,"CHE00191","N"
81314,103050,"Goods",733,,36,"Industrial Support Belt, Medium, 33 inch to 38 inch, Black","EA","",42.95,"CHE00192","N"
81314,103051,"Goods",734,,36,"Industrial Support Belt, Large, 39 inch to 44 inch, Black","EA","",42.95,"CHE00193","N"
81314,103052,"Goods",735,,36,"Industrial Support Belt, X Large, 45 inch to 49 inch, Black","EA","",42.95,"CHE00194","N"
81314,103053,"Goods",736,,36,"Gray Cloth Index Tab Strips, 6 inch x 7/8 inch","PACK","",4.05,"AVE59108","N"
81314,103054,"Goods",737,,36,"Gray Cloth Index Tabs, Round","PACK","",2.93,"AVE59112","N"
81314,103055,"Goods",738,,36,"Gray Cloth Index Tabs, 7/16 inch x 13/16 inch","PACK","",2.93,"AVE59105","N"
81314,103056,"Goods",739,,36,"White Paper Index Tabs, Round","PACK","",2.83,"AVE59102","N"
81314,103057,"Goods",740,,36,"Laserable Self-Adhesive Index Tabs, 1-1/2 inch, Clear","PACK","",5.35,"AVE16230","N"
81314,103058,"Goods",741,,36,"Tabbing Strips, 1/2 inch, Clear","BX","",2.13,"AVE16101","N"
81314,103059,"Goods",742,,36,"Tabbing Strips, 1/3 inch, Clear","BX","",2.13,"AVE16120","N"
81314,103060,"Goods",743,,36,"Laserable Self-Adhesive Index Tabs, 2 inch, Clear","PACK","",6.75,"AVE16241","N"
81314,103061,"Goods",744,,36,"Laserable Self-Adhesive Index Tabs, 1 inch, Clear","PACK","",3.83,"AVE16221","N"
81314,103062,"Goods",745,,36,"Gray Cloth Index Tabs, 1 inch x 13/16 inch","PACK","",3.63,"AVE59106","N"
81314,103063,"Goods",746,,36,"Avery Swiftabs, 1-1/2 inch Write-On/Type-On Adhesive Plastic Tabs, Red","PACK","",2.95,"AVE22207","N"
81314,103064,"Goods",747,,36,"Avery Swiftabs, 1-1/2 inch Write-On/Type-On Adhesive Plastic Tabs, Blue","PACK","",2.95,"AVE22208","N"
81314,103065,"Goods",748,,36,"Avery Swiftabs, 1-1/2 inch Write-On/Type-On Adhesive Plastic Tabs, White","PACK","",2.95,"AVE22211","N"
81314,103066,"Goods",749,,36,"Fine Line Pen, Green, Point 88","EA","",0.95,"AVE48705","N"
81314,103067,"Goods",750,,36,"Fine Line Pen, Lilac, Point 88","EA","",0.95,"AVE48716","N"
81314,103068,"Goods",751,,36,"Fine Line Pen, Pink, Point 88","EA","",0.95,"AVE48714","N"
81314,103069,"Goods",752,,36,"Sensor Cushion Tip Pen, Fine, Black","EA","",1.39,"AVE49298","N"
81314,103070,"Goods",753,,36,"Sensor Cushion Tip Pen, Fine, Red","EA","",1.39,"AVE49297","N"
81314,103071,"Goods",754,,36,"Sensor Cushion Tip Pen, Fine, Blue","EA","",1.39,"AVE49296","N"
81314,103072,"Goods",755,,36,"Chisel Tip Dry Erase Marker, Green","EA","",2.19,"AVE29895","N"
81314,103073,"Goods",756,,36,"Chisel Tip Dry Erase Marker, Purple","EA","",2.19,"AVE29894","N"
81314,103074,"Goods",757,,36,"Chisel Tip Dry Erase Marker, Black","EA","",2.19,"AVE29898","N"
81314,103075,"Goods",758,,36,"Chisel Tip Dry Erase 4-Color Marker Set","SET","",8.89,"AVE29849","N"
81314,103076,"Goods",759,,36,"Dry Erase Marker, Chisel Point, Green","EA","",1.65,"AVE24405","N"
81314,103077,"Goods",760,,36,"Marks-A-Lot Whiteboard Marker","SET","",5.44,"AVE24459","N"
81314,103078,"Goods",761,,36,"Marks-A-Lot Whiteboard Marker, Green","EA","",1.36,"AVE24455","N"
81314,103079,"Goods",762,,36,"Marks-A-Lot Whiteboard Marker, Blue","EA","",1.36,"AVE24456","N"
81314,103080,"Goods",763,,36,"Marks-A-Lot Whiteboard Marker, Black","EA","",1.36,"AVE24458","N"
81314,103081,"Goods",764,,36,"Marks-A-Lot Whiteboard Marker, Red","EA","",1.36,"AVE24457","N"
81314,103082,"Goods",765,,36,"Chisel Tip Dry Erase Marker, Orange","EA","",2.19,"AVE29893","N"
81314,103083,"Goods",766,,36,"Chisel Tip Dry Erase Marker, Yellow","EA","",2.19,"AVE29892","N"
81314,103084,"Goods",767,,36,"Chisel Tip Dry Erase Marker, Brown","EA","",2.19,"AVE29891","N"
81314,103085,"Goods",768,,36,"Chisel Tip Dry Erase Marker Starter Set","SET","",10.64,"AVE29830","N"
81314,103086,"Goods",769,,36,"Marks-A-Lot Dry Erase 8-Color Marker Set, Chisel Point","SET","",13.2,"AVE24411","N"
81314,103087,"Goods",770,,36,"Marks-A-Lot Dry Erase Marker, Chisel Point, Red","EA","",1.65,"AVE24407","N"
81314,103088,"Goods",771,,36,"Marks-A-Lot Dry Erase Marker, Chisel Point, Black","EA","",1.65,"AVE24408","N"
81314,103089,"Goods",772,,36,"Marks-A-Lot Dry Erase 4-Color Marker Set, Chisel Point","SET","",6.6,"AVE24409","N"
81314,103090,"Goods",773,,36,"Marks-A-Lot Dry Erase Marker, Chisel Point, Blue","EA","",1.65,"AVE24406","N"
81314,103091,"Goods",774,,36,"Chisel Tip Dry Erase Marker, Red","EA","",2.19,"AVE29897","N"
81314,103092,"Goods",775,,36,"Chisel Tip Dry Erase Marker, Blue","EA","",2.19,"AVE29896","N"
81314,103093,"Goods",776,,36,"Loose-Leaf Diskette Protector, 3-1/2 inch Diskettes, 4 Disk Capacity","BX","",9.5,"CLI61748","N"
81314,103094,"Goods",777,,36,"Suspend-A-Pocket Hanging Diskettes File, 20 Disk Capacity","PACK","",14.95,"ACC50029","N"
81314,103095,"Goods",778,,36,"Diskette Holder, Self Adhesive 3-1/2 inch","PACK","",6.6,"CLI70548","N"
81314,103096,"Goods",779,,36,"Hang-it-All Coat Clip, Single-Sided Hook","EA","",5.75,"ARZ1309","N"
81314,103097,"Goods",780,,36,"Hang-It-All Coat Clip, Double-Sided Hook","EA","",7.15,"ARZ49232","N"
81314,103098,"Goods",781,,36,"Glossy Photo-Quality Business Cards for Inkjet Printers, 2 inch x 3-1/2 inch","PACK","",21.99,"AVE08373","N"
81314,103099,"Goods",782,,36,"Inkjet Business Cards, 2 inch x 3-1/2 inch Card Size, White","BX","",14.04,"AVE08371","N"
81314,103100,"Goods",783,,36,"Laser Business Cards for Laser Printers, 2 inch x 3-1/2 inch Card Size, White","BX","",14.04,"AVE05371","N"
81314,103101,"Goods",784,,36,"Laser/Inkjet Business Cards, 2 inch x 3-1/2 inch Card Size, Ivory","BX","",14.04,"AVE05376","N"
81314,103102,"Goods",785,,36,"Avery Laser/Inkjet Business Cards and Laminated Identification Cards, Laser, 2 inch x 3-1/2 inch, White","BX","",102.71,"AVE05911","N"
81314,103103,"Goods",786,,36,"Laser Tent Card, 8-1/2 inch x 2-1/2 inch","BX","",22.45,"AVE05305","N"
81314,103104,"Goods",787,,36,"Laser Tent Card, 11 inch x 3-1/2 inch","BX","",22.45,"AVE05309","N"
81314,103105,"Goods",788,,36,"Postcard for Laser Printers, 4 inch x 6 inch","BX","",22.45,"AVE05389","N"
81314,103106,"Goods",789,,36,"Personal Creation Card for Inkjet Printers, 15 Ivory, Embossed, Half-Fold Cards/Envelopes, 5-1/2 inch x 8-1/2 inch","BX","",10.99,"AVE03260","N"
81314,103107,"Goods",790,,36,"Personal Creation Card for Inkjet Printers, 60 Mini-Fold Cards, 30 Envelopes, 2 inch x 3-1/2 inch","BX","",10.99,"AVE03264","N"
81314,103108,"Goods",791,,36,"Avery Laser/Inkjet Business Cards and Laminated Identification Cards, 2 inch x 3-1/4 inch, White","BX","",18.99,"AVE05361","N"
81314,103109,"Goods",792,,36,"Avery Laser/Inkjet Note Card, Envelopes Included","BX","",21.58,"AVE08315","N"
81314,103110,"Goods",793,,36,"Avery Laser/Inkjet Greeting Card, Envelopes Included","BX","",21.58,"AVE08316","N"
81314,103111,"Goods",794,,36,"Personal Creation Card for Inkjet Printers with 15 Photo Frame Cards/Envelopes, 5 inch x 7 inch","EA","",10.99,"AVE03258","N"
81314,103112,"Goods",795,,36,"Personal Creation Card, 2 inch x 3-1/2 inch","PACK","",10.99,"AVE03263","N"
81314,103113,"Goods",796,,36,"Personal Creation Card for Inkjet Printers with 30 Note Cards/Envelopes, 2 inch x 3-1/2 inch","EA","",10.99,"AVE03268","N"
81314,103114,"Goods",797,,36,"Glossy Photo-Quality Cards for Inkjet Printers with 10 Half-Fold Cards/Envelopes","EA","",10.99,"AVE03269","N"
81314,103115,"Goods",798,,36,"Laser Cards, 50 Note Cards/Envelopes, 4-1/4 inch x 5-1/2 inch, White","BX","",21.58,"AVE05315","N"
81314,103116,"Goods",799,,36,"Glossy Photo-Quality Post Cards for Inkjet Printers, 4 inch x 6 inch","PACK","",21.99,"AVE08389","N"
81314,103117,"Goods",800,,36,"Table and Tab Divider, Multi Color, Monthly Tab","SET","",4.2,"AVE11679","N"
81314,103118,"Goods",801,,36,"Table and Tab Divider, Black and White, Monthly Tab","SET","",4.2,"AVE11678","N"
81314,103119,"Goods",802,,36,"OneStep Images Index, Blue/Gray","SET","",6.1,"CRD61521","N"
81314,103120,"Goods",803,,36,"OneStep Images Index, Pin Stripe","SET","",6.1,"CRD61522","N"
81314,103121,"Goods",804,,36,"OneStep Images Index, Gray Marble","SET","",6.1,"CRD61528","N"
81314,103122,"Goods",805,,36,"OneStep Images Index, World Map","SET","",6.1,"CRD61525","N"
81314,103123,"Goods",806,,36,"Table 'N Tabs Divider, Black and White, Indexed A to Z","SET","",4.99,"AVE11676","N"
81314,103124,"Goods",807,,36,"Table 'N Tabs Divider, Black and White, Indexed 1 to 31","SET","",6.5,"AVE11680","N"
81314,103125,"Goods",808,,36,"OneStep Index System, Alpha, A to Z, Clear","EA","",4.99,"CRD60213","N"
81314,103126,"Goods",809,,36,"OneStep Index System, Monthly, MultiColor","EA","",4.2,"CRD60318","N"
81314,103127,"Goods",810,,36,"OneStep Index System, Daily, 1 to 31, Clear","EA","",6.5,"CRD60113","N"
81314,103128,"Goods",811,,36,"Binder Index, Pre-Printed, A-Z, Leather, 11 inch x 8-1/2 inch","EA","",4.38,"AVE11323","N"
81314,103129,"Goods",812,,36,"Premium Gold Line Black Leather Tab Divider, Indexed January to December","SET","",5.65,"AVE11351","N"
81314,103130,"Goods",813,,36,"Premium Gold Line Black Leather Tab Divider, Indexed 1 to 31","SET","",9.18,"AVE11352","N"
81314,103131,"Goods",814,,36,"Red Leather Tab Divider, Indexed January to December, Buff","SET","",5.1,"AVE11328","N"
81314,103132,"Goods",815,,36,"Premium Gold Line Preprinted Divider, Indexed 1 to 31, Buff","SET","",10.68,"AVE11308","N"
81314,103133,"Goods",816,,36,"Premium Gold Line Preprinted Divider, Indexed January to December, Buff","SET","",5.78,"AVE11307","N"
81314,103134,"Goods",817,,36,"Premium Gold Line Black Leather Tab Divider, Indexed A to Z","SET","",4.68,"AVE11350","N"
81314,103135,"Goods",818,,36,"Red Leather Tab Divider, Indexed 1 to 31, Buff","SET","",8.85,"AVE11327","N"
81314,103136,"Goods",819,,36,"OneStep Images Index, Spectrum","SET","",6.1,"CRD61524","N"
81314,103137,"Goods",820,,36,"OneStep Images Index, Shadow","SET","",6.1,"CRD61527","N"
81314,103138,"Goods",821,,36,"OneStep Index System, Alpha, Indexed A to Z, Multi Color","SET","",4.99,"CRD60218","N"
81314,103139,"Goods",822,,36,"FastPack Ready Index Divider, Indexed 1 to 5, Multi Color","BX","",49.63,"AVE11167","N"
81314,103140,"Goods",823,,36,"Table and Tab Divider, Multi Color, Indexed A to Z","SET","",4.99,"AVE11677","N"
81314,103141,"Goods",824,,36,"Round Table Top, Walnut, 36 inch","EA","",177,"BVS17212","N"
81314,103142,"Goods",825,,36,"Round Table Top, Medium Oak, 36 inch","EA","",177,"BVS10317","N"
81314,103143,"Goods",826,,36,"Round Table Top, Mahogany, 36 inch","EA","",177,"BVS17211","N"
81314,103144,"Goods",827,,36,"Round Table Top, Walnut, 42 inch","EA","",207,"BVS17214","N"
81314,103145,"Goods",828,,36,"Round Table Top, Medium Oak, 42 inch","EA","",207,"BVS40240","N"
81314,103146,"Goods",829,,36,"Round Table Top, Mahogany, 42 inch","EA","",207,"BVS17213","N"
81314,103147,"Goods",830,,36,"Round Table Top, Walnut, 48 inch","EA","",236,"BVS24538","N"
81314,103148,"Goods",831,,36,"Round Table Top, Medium Oak, 48 inch","EA","",236,"BVS24537","N"
81314,103149,"Goods",832,,36,"Round Table Top, Mahogany, 48 inch","EA","",236,"BVS23391","N"
81314,103150,"Goods",833,,36,"Huskee Powerotor Floor and Carpet Sweeper, 9-1/4 inch Sweep Swath, Black","EA","",60,"CMC05634","N"
81314,103151,"Goods",834,,36,"Huskee Floor and Carpet Sweeper, Blue","EA","",60,"CMC02648","N"
81314,103152,"Goods",835,,36,"Pro Data-Vac with Micro Tools Replacement Bag and Toner Kit, Includes 5 Bags and 2 Toner Filters","PACK","",39.5,"DTV51675","N"
81314,103153,"Goods",836,,36,"Mini Computer Vacuum with 2 Attachments","EA","",15,"CCP00404","N"
81314,103154,"Goods",837,,36,"Pro Data-Vac 2 with Micro Tools, 1.17 PHP","EA","",205,"DTV92689","N"
81314,103155,"Goods",838,,36,"Metro Data-Vac with 5 Micro Tools Replacement Bags","PACK","",4.75,"DTV51662","N"
81314,103156,"Goods",839,,36,"Pro Data-Vac with Micro Tools with Carrying Case, 1.7 php, 2 Speed","EA","",299,"DTV12395","N"
81314,103157,"Goods",840,,36,"Microsweep Vacuum, 8 ounce, 115 volt","EA","",26,"DTV12596","N"
81314,103158,"Goods",841,,36,"Pro Data-Vac with Micro Tools and Carrying Case, 1.17 php","EA","",259,"DTV12295","N"
81314,103159,"Goods",842,,36,"Vacuum, 17 PHP, Two-Speed","EA","",237,"DTV51685","N"
81314,103160,"Goods",843,,36,"Dustbuster Classic Plus Filter","BX","",6.15,"BLA50404","N"
81314,103161,"Goods",844,,36,"Dustbuster Classic Plus Vacuum","EA","",69.95,"BLA50635","N"
81314,103162,"Goods",845,,36,"Phone, 2 Line, CID, Speaker, 962, Digital","EA","",159.99,"ATT21076","N"
81314,103163,"Goods",846,,36,"Avery Metal Rim Tags, Hole-punched, Strung with White Cord, 2-1/4 inch Depth","CARTON","",102.59,"AVE14316","N"
81314,103164,"Goods",847,,36,"Avery Metal Rim Tags, Hole-punched, Strung with White Cord, 1-1/4 inch D","CARTON","",64.79,"AVE14313","N"
81314,103165,"Goods",848,,36,"Avery Metal Rim Tags, Hole-punched, Strung with White Cord, 1-9/16 inch D","CARTON","",73.09,"AVE14314","N"
81314,103166,"Goods",849,,36,"Avery Metal Rim Tags, Hole-punched, Strung with White Cord, 1-7/8 inch D","CARTON","",86.09,"AVE14315","N"
81314,103167,"Goods",850,,36,"Tags, Merchandise, White, 2-3/4 inch x 1-11/16 inch","EA","",2.99,"AVE11012","N"
81314,103168,"Goods",851,,36,"Sterile Gauze Roll, 4 inch","BX","",7.65,"ACM51018","N"
81314,103169,"Goods",852,,36,"Three-Piece Plier Set","SET","",22.95,"BOS84103","N"
81314,103170,"Goods",853,,36,"Literature/Magazine Rack, Multi Pockets","EA","",49.98,"DEF52009","N"
81314,103171,"Goods",854,,36,"Literature/Magazine Rack, 8 Tier","EA","",79.98,"DEF52209","N"
81314,103172,"Goods",855,,36,"Multi Pockets Literature Holder, 4 Pockets","EA","",44.95,"DEF52509","N"
81314,103173,"Goods",856,,36,"Multi Pockets Literature Holder, 12 Pockets","EA","",89.95,"DEF52809","N"
81314,103174,"Goods",857,,36,"Lobby Broom","EA","",7.17,"CMC01315","N"
81314,103175,"Goods",858,,36,"Inkjet Shipping Label, Clear, 1/2 inch x 1-3/4 inch","EA","",26.99,"AVE08667","N"
81314,103176,"Goods",859,,36,"Inkjet Shipping Label for Color Copier, 2 inch x 4 inch","PACK","",15.99,"AVE08253","N"
81314,103177,"Goods",860,,36,"Inkjet Address Label for Color Copier, 1 inch x 2-5/8 inch","PACK","",15.99,"AVE08250","N"
81314,103178,"Goods",861,,36,"Inkjet Address Label, 1-1/3 inch x 4 inch, White","BX","",12.23,"AVE08162","N"
81314,103179,"Goods",862,,36,"Inkjet Address Label, 1-1/3 inch x 4 inch, Clear","BX","",26.99,"AVE08662","N"
81314,103180,"Goods",863,,36,"Inkjet Shipping Label, 3-1/3 inch x 4 inch, White","BX","",12.23,"AVE08164","N"
81314,103181,"Goods",864,,36,"Inkjet Shipping Label, 2 inch x 4 inch","BX","",12.23,"AVE08163","N"
81314,103182,"Goods",865,,36,"Inkjet Address Label, 2 inch x 4 inch, Clear","BX","",26.99,"AVE08663","N"
81314,103183,"Goods",866,,36,"Inkjet Address Label, Return Address, 1/2 inch x 1-3/4 inch, White","BX","",12.23,"AVE08167","N"
81314,103184,"Goods",867,,36,"Inkjet Address Label, 1-1/3 inch x 4 inch, White","BX","",42.01,"AVE08462","N"
81314,103185,"Goods",868,,36,"Inkjet Shipping Label, 2 inch x 4 inch, White","BX","",42.01,"AVE08463","N"
81314,103186,"Goods",869,,36,"Inkjet Address Label, 1 inch x 2-5/8 inch, White","BX","",12.23,"AVE08160","N"
81314,103187,"Goods",870,,36,"Inkjet Address Label, 1 inch x 2-5/8 inch, Clear","BX","",26.99,"AVE08660","N"
81314,103188,"Goods",871,,36,"Inkjet Address Label, 1 inch x 4 inch, White","BX","",12.23,"AVE08161","N"
81314,103189,"Goods",872,,36,"Self-Adhesive Mailing Label, 3 inch x 4 inch","PACK","",7.19,"AVE05280","N"
81314,103190,"Goods",873,,36,"Sheet-Fed Address Label for Copiers, 1 inch x 2-13/16 inch","BX","",81.13,"AVE05332","N"
81314,103191,"Goods",874,,36,"Sheet-Fed Address Label for Copiers, 1-3/8 inch x 2-13/16 inch","BX","",43.25,"AVE05363","N"
81314,103192,"Goods",875,,36,"Sheet-Fed Address Label for Copiers, 1 inch x 2-3/4 inch","BX","",156.84,"AVE05334","N"
81314,103193,"Goods",876,,36,"Sheet-Fed Address Label for Copiers, 1 inch x 2-3/4 inch","BX","",33.49,"AVE05351","N"
81314,103194,"Goods",877,,36,"Sheet-Fed Address Label for Copiers, 2 inch x 4-1/4 inch","BX","",43.25,"AVE05352","N"
81314,103195,"Goods",878,,36,"Sheet-Fed Address Label for Copiers, 8-1/2 inch x 11 inch","BX","",43.25,"AVE05353","N"
81314,103196,"Goods",879,,36,"Sheet-Fed Address Label for Copiers, 1 inch x 2-3/4 inch","BX","",13.32,"AVE05354","N"
81314,103197,"Goods",880,,36,"Sheet-Fed Address Label for Copiers, 1-1/2 inch x 2-3/4 inch","BX","",43.25,"AVE05360","N"
81314,103198,"Goods",881,,36,"Inkjet Address Label, 1 inch x 2-5/8 inch, White","BX","",42.01,"AVE08460","N"
81314,103199,"Goods",882,,36,"Pen Style Hi-Liter, Fluorescent Orange","EA","",0.79,"AVE23595","N"
81314,103200,"Goods",883,,36,"Pen Style Hi-Liter, Fluorescent Purple","EA","",0.79,"AVE23596","N"
81314,103201,"Goods",884,,36,"Pen Style Hi-Liter, Fluorescent Pink","EA","",0.79,"AVE23592","N"
81314,103202,"Goods",885,,36,"Pen Style Hi-Liter","SET","",4.74,"AVE23565","N"
